Description,Test_name,Records_flagged,perc_number_records(*)
Records missing scientific name,.missing_name,3086,3.43
Records missing coordinates,.missing_coordinates,19391,21.55
Records with invalid coordiantes,.invalid_coordinates,278,0.31
Records from doubtful source,.invalid_basis_of_records,38,0.04
Records outside one or multiple focal countries,.coordinates_out_country,26449,29.39
Summary of all tests,.summary,29055,32.28
"","","",""
"(*) calculated in relation to total number of records, i.e. 5 records","","",""
